{
  "journal": "Scandinavian Journal of Medicine & Science in Sports",
  "doi": "10.1111/j.1600-0838.2012.01445.x",
  "pmid": "22376273",
  "pmcid": null,
  "url": "https://doi.org/10.1111/j.1600-0838.2012.01445.x",
  "openAccess": false,
  "population": "Healthy adults in the HUNT Fitness Study",
  "sampleSize": 3320,
  "studyCount": null,
  "effectSize": null,
  "limitations": [
    "Predominantly Caucasian Norwegian adults",
    "Equation may not generalise to clinical populations"
  ],
  "retracted": false,
  "retractionNotes": null,
  "contentRefKeys": [],
  "lastVerified": "2026-10-22",
  "verificationStatus": "verified",
  "id": "nes-hrmax-2013",
  "type": "cohort",
  "title": "Age-predicted maximal heart rate in healthy subjects: The HUNT Fitness Study",
  "authors": [
    "Nes BM",
    "Janszky I",
    "Wisløff U",
    "Støylen A",
    "Karlsen T"
  ],
  "year": 2013,
  "keyFinding": {
    "enGB": "In a large healthy Norwegian sample, maximal heart rate was better described by 211 − 0.64×age than by 220 − age.",
    "uk": "У великій вибірці здорових норвежців максимальна ЧСС краще описується як 211 − 0,64×вік, ніж 220 − вік."
  },
  "evidenceGrade": {
    "level": "moderate",
    "rationale": "Large population fitness cohort with measured HRmax; still population-specific."
  },
  "usedByClaimIds": [
    "formula-hrmax-nes"
  ]
}
