{
  "journal": "Journal of Sports Sciences",
  "doi": "10.1080/02640414.2018.1555906",
  "pmid": "30558493",
  "pmcid": null,
  "url": "https://doi.org/10.1080/02640414.2018.1555906",
  "openAccess": false,
  "population": null,
  "sampleSize": null,
  "studyCount": null,
  "effectSize": null,
  "limitations": [
    "Limited study count for some comparisons"
  ],
  "retracted": false,
  "retractionNotes": null,
  "contentRefKeys": [
    "doi:10.1080/02640414.2018.1555906"
  ],
  "lastVerified": "2026-10-22",
  "verificationStatus": "verified",
  "id": "schoenfeld-frequency-2019",
  "type": "meta-analysis",
  "title": "How many times per week should a muscle be trained to maximize muscle hypertrophy? A systematic review and meta-analysis of evidence regarding resistance training frequency",
  "authors": [
    "Schoenfeld BJ",
    "Grgic J",
    "Krieger JW"
  ],
  "year": 2019,
  "keyFinding": {
    "enGB": "On a volume-equated basis, resistance-training frequency has small or null effects on hypertrophy; frequency mainly helps distribute volume.",
    "uk": "За зрівняного обсягу частота силових тренувань має малий або нульовий вплив на гіпертрофію; частота головно допомагає розподілити обсяг."
  },
  "evidenceGrade": {
    "level": "moderate",
    "rationale": "Volume-equated meta-analysis clarifying frequency vs volume."
  },
  "usedByClaimIds": [
    "prog-frequency-volume-equated"
  ]
}
