{
  "journal": "Sports Medicine",
  "doi": "10.1007/s40279-013-0071-8",
  "pmid": "23852425",
  "pmcid": null,
  "url": "https://doi.org/10.1007/s40279-013-0071-8",
  "openAccess": false,
  "population": null,
  "sampleSize": null,
  "studyCount": null,
  "effectSize": null,
  "limitations": [
    "Protocol heterogeneity",
    "Consumer wearables may not match research ECG/RR methods"
  ],
  "retracted": false,
  "retractionNotes": null,
  "contentRefKeys": [],
  "lastVerified": "2026-10-22",
  "verificationStatus": "verified",
  "id": "plews-hrv-monitoring-2013",
  "type": "systematic-review",
  "title": "Training adaptation and heart rate variability in elite endurance athletes: opening the door to effective monitoring",
  "authors": [
    "Plews DJ",
    "Laursen PB",
    "Stanley J",
    "Kilding AE",
    "Buchheit M"
  ],
  "year": 2013,
  "keyFinding": {
    "enGB": "Guided by trends in resting heart-rate variability, endurance athletes can better match hard sessions to recovery than by fixed calendars alone.",
    "uk": "Орієнтуючись на тренди варіабельності серцевого ритму у спокої, спортсмени на витривалість можуть краще узгоджувати важкі сесії з відновленням, ніж лише за фіксованим календарем."
  },
  "evidenceGrade": {
    "level": "moderate",
    "rationale": "Authoritative synthesis of HRV monitoring studies in endurance athletes; methods vary."
  },
  "usedByClaimIds": [
    "recovery-hrv-guided-training"
  ]
}
