{
  "journal": null,
  "doi": null,
  "pmid": null,
  "pmcid": null,
  "url": null,
  "openAccess": false,
  "population": null,
  "sampleSize": null,
  "studyCount": null,
  "effectSize": null,
  "limitations": [
    "Not a primary study",
    "Surfaces uncertainty rather than a positive claim"
  ],
  "retracted": false,
  "retractionNotes": null,
  "contentRefKeys": [
    "guideline:omnigart-mileage-caveat"
  ],
  "lastVerified": "2026-10-22",
  "verificationStatus": "unverified",
  "id": "omnigart-mileage-caveat",
  "type": "guideline",
  "title": "OmniGart caveat: fixed ~10% weekly mileage progression lacks strong RCT support",
  "authors": [
    "OmniGart Evidence Working Notes"
  ],
  "year": 2026,
  "keyFinding": {
    "enGB": "A fixed ~10% weekly mileage increase is a coaching heuristic with weak trial support; readiness and injury signals should override the percentage.",
    "uk": "Фіксоване збільшення тижневого кілометражу приблизно на 10% — тренерська евристика зі слабкою підтримкою в дослідженнях; готовність і сигнали травм мають мати пріоритет над відсотком."
  },
  "evidenceGrade": {
    "level": "very-low",
    "rationale": "Explicit product caveat documenting weak evidence for a popular rule."
  },
  "usedByClaimIds": [
    "cardio-mileage-10pct-caveat"
  ]
}
