{
  "journal": "Cardiometry",
  "doi": "10.12710/cardiometry.2017.10.6676",
  "pmid": null,
  "pmcid": null,
  "url": "https://doi.org/10.12710/cardiometry.2017.10.6676",
  "openAccess": true,
  "population": null,
  "sampleSize": null,
  "studyCount": null,
  "effectSize": null,
  "limitations": [
    "Not a large outcome RCT",
    "Original Russian-language methods literature is out of scope for this locale set"
  ],
  "retracted": false,
  "retractionNotes": null,
  "contentRefKeys": [],
  "lastVerified": "2026-10-22",
  "verificationStatus": "verified",
  "id": "baevsky-hrv-methods-2017",
  "type": "book-coaching-source",
  "title": "Heart rate variability analysis: physiological foundations and main methods",
  "authors": [
    "Baevsky RM",
    "Chernikova AG"
  ],
  "year": 2017,
  "keyFinding": {
    "enGB": "The stress index (SI) derived from RR-interval histogram geometry is presented as one method among HRV analyses for assessing autonomic tension.",
    "uk": "Індекс напруження (SI), отриманий з геометрії гістограми RR-інтервалів, подається як один із методів аналізу ВСР для оцінки вегетативної напруги."
  },
  "evidenceGrade": {
    "level": "low",
    "rationale": "Methods overview rooted in the Baevsky tradition; limited English-language trial evidence for consumer decision rules."
  },
  "usedByClaimIds": [
    "recovery-baevsky-stress-index"
  ]
}
